{
  "object_type": "persona",
  "osmm_version": "0.1.0",
  "persona_id": "PER-warby-parker-design-conscious",
  "version": "1.0",
  "status": "draft",
  "name": "The Design-Conscious Buyer",
  "persona_type": "consumer",
  "summary": "A style-aware, value-oriented urban or suburban adult who needs prescription eyewear and refuses to accept that good design must come with a legacy-optical price tag or a tedious buying experience.",
  "representative_quote": "I want glasses that look like me and don't cost a fortune — and I'd really rather not spend an afternoon at an optical shop to get them.",
  "demographics": {
    "age": "Late 20s to early 40s",
    "household": "Single or partnered; often urban/suburban professional",
    "income": "Middle to upper-middle income",
    "location": "Urban and suburban metros",
    "occupation": "Knowledge worker / creative professional"
  },
  "triggers": [
    "An eye exam or a new/changed prescription that requires fresh glasses",
    "An old pair breaking, wearing out, or feeling stylistically dated",
    "Wanting a second pair or sunglasses to round out a wardrobe",
    "Seeing the brand through a friend's pair, social, or a nearby store"
  ],
  "goals": [
    "Get well-designed glasses that express personal style",
    "Avoid overpaying relative to traditional optical retail",
    "Buy with minimal hassle and low risk of choosing wrong",
    "Feel good about the purchase, including the brand's values"
  ],
  "motivations": [
    "Self-expression — eyewear as a visible part of personal style",
    "Smart-shopper satisfaction — quality without the markup",
    "Convenience and control over the buying experience",
    "Affinity for brands whose values and design sensibility match their own"
  ],
  "pain_points": [
    "Traditional eyewear is overpriced and the markups feel opaque",
    "Hard to judge how frames will actually look without trying them on",
    "In-store optical shopping is time-consuming and high-pressure",
    "Too many similar options with little to differentiate them"
  ],
  "objections": [
    "Uncertainty about buying prescription eyewear online sight-unseen",
    "Concern that a low price implies lower quality or durability",
    "Whether the prescription and fit will be right without an in-person optician"
  ],
  "behavioral_traits": [
    "Researches and discovers on mobile and social; comfortable buying online",
    "Relies on reviews, friends, and visible social proof over advertising",
    "Values frictionless try-before-you-buy and easy returns",
    "Cross-shops between online-only and physical try-on before committing",
    "Loyal and high-repeat once a brand earns trust on fit and style"
  ],
  "decision_criteria": [
    "Frame style and how it looks on them",
    "Price relative to perceived quality and value",
    "Low-risk ways to try before buying (home try-on, virtual try-on, nearby store)",
    "Brand reputation, reviews, and values alignment",
    "Ease of getting the right prescription and fit"
  ],
  "messaging_preferences": [
    "Lead with design and how the product looks and feels, not technical specs",
    "Make the try-before-you-buy promise and price transparency front and center",
    "Use social proof and real customers as primary credibility signals",
    "Reach via social, search, and physical-store presence; keep tone witty and human, not salesy",
    "Surface the give-back mission as a reinforcing detail, not the headline"
  ],
  "linked_audiences": ["AUD-PLACEHOLDER-warby-parker-first-time-buyer"],
  "source": "Illustrative persona synthesized from publicly available market knowledge of Warby Parker's target customer (brand positioning, public reporting, and category research), 2024. Grounded in public information, not client research; more synthesized than a document-derived instance."
}
